{
  "generated_at": "2026-09-09T06:45:00Z",
  "metadata": {
    "limit": "This report compares recorded plans, mappings, bindings, and evidence. It does not discover omitted obligations or infer semantic coverage outside those records."
  },
  "obligations": [
    {
      "actual_defense_ids": ["UPH-02-01:d:schema", "UPH-02-01:d:fixture"],
      "gap_state": "gaps",
      "gaps": [
        {"defense_ids": ["UPH-02-01:d:schema"], "id": "UPH-02-01:gap:member-UPH-02-01:schema-unproven", "kind": "unproven_defense", "metadata": {}, "next_action": "Run a compatible fault challenge and explicitly bind supporting evidence for UPH-02-01:schema.", "rationale": "Presence or a passing suite does not establish that the defense detects the stated fault.", "recommendation_member_ids": ["UPH-02-01:schema"], "scope": "docs/PRODUCT_MODEL.md", "severity": "unknown", "status": "open", "summary": "Defense for recommended member UPH-02-01:schema exists but has no bound supporting evidence."},
        {"defense_ids": ["UPH-02-01:d:fixture"], "id": "UPH-02-01:gap:member-UPH-02-01:fixture-unproven", "kind": "unproven_defense", "metadata": {}, "next_action": "Run a compatible fault challenge and explicitly bind supporting evidence for UPH-02-01:fixture.", "rationale": "Presence or a passing suite does not establish that the defense detects the stated fault.", "recommendation_member_ids": ["UPH-02-01:fixture"], "scope": "docs/PRODUCT_MODEL.md", "severity": "unknown", "status": "open", "summary": "Defense for recommended member UPH-02-01:fixture exists but has no bound supporting evidence."}
      ],
      "metadata": {},
      "next_actions": ["Run a compatible fault challenge and explicitly bind supporting evidence for UPH-02-01:schema.", "Run a compatible fault challenge and explicitly bind supporting evidence for UPH-02-01:fixture."],
      "obligation_id": "UPH-02-01",
      "recommendation_status": "proposed",
      "selected_plan_id": "UPH-02-01:plan"
    },
    {
      "actual_defense_ids": [],
      "gap_state": "gaps",
      "gaps": [
        {"defense_ids": [], "id": "UPH-02-02:gap:member-UPH-02-02:recommend-missing", "kind": "no_defense", "metadata": {}, "next_action": "Implement the member or review the plan. Proposed challenge: Change a hard constraint and require the preferred plan to change.", "rationale": "Choose plans under project constraints instead of a fixed defense ranking.", "recommendation_member_ids": ["UPH-02-02:recommend"], "scope": "docs/POSITIONING.md", "severity": "unknown", "status": "open", "summary": "Recommended defense member UPH-02-02:recommend has no mapped implementation."},
        {"defense_ids": [], "id": "UPH-02-02:gap:member-UPH-02-02:eval-missing", "kind": "no_defense", "metadata": {}, "next_action": "Implement the member or review the plan. Proposed challenge: Score scope, bypasses, constraints, and portfolio need.", "rationale": "Compare suggestions with independently reviewed acceptable plans.", "recommendation_member_ids": ["UPH-02-02:eval"], "scope": "docs/POSITIONING.md", "severity": "unknown", "status": "open", "summary": "Recommended defense member UPH-02-02:eval has no mapped implementation."}
      ],
      "metadata": {},
      "next_actions": ["Implement the member or review the plan. Proposed challenge: Change a hard constraint and require the preferred plan to change.", "Implement the member or review the plan. Proposed challenge: Score scope, bypasses, constraints, and portfolio need."],
      "obligation_id": "UPH-02-02",
      "recommendation_status": "proposed",
      "selected_plan_id": "UPH-02-02:plan"
    },
    {
      "actual_defense_ids": ["UPH-02-03:d:gap"],
      "gap_state": "gaps",
      "gaps": [
        {"defense_ids": [], "id": "UPH-02-03:gap:member-UPH-02-03:inventory-missing", "kind": "no_defense", "metadata": {}, "next_action": "Implement the member or review the plan. Proposed challenge: Seed a plausible name match that does not guard the obligation.", "rationale": "Find actual defenses by reading mechanism and scope.", "recommendation_member_ids": ["UPH-02-03:inventory"], "scope": "skills/upheld/SKILL.md", "severity": "unknown", "status": "open", "summary": "Recommended defense member UPH-02-03:inventory has no mapped implementation."},
        {"defense_ids": ["UPH-02-03:d:gap"], "id": "UPH-02-03:gap:member-UPH-02-03:gap-unproven", "kind": "unproven_defense", "metadata": {}, "next_action": "Run a compatible fault challenge and explicitly bind supporting evidence for UPH-02-03:gap.", "rationale": "Presence or a passing suite does not establish that the defense detects the stated fault.", "recommendation_member_ids": ["UPH-02-03:gap"], "scope": "skills/upheld/SKILL.md", "severity": "unknown", "status": "open", "summary": "Defense for recommended member UPH-02-03:gap exists but has no bound supporting evidence."}
      ],
      "metadata": {},
      "next_actions": ["Implement the member or review the plan. Proposed challenge: Seed a plausible name match that does not guard the obligation.", "Run a compatible fault challenge and explicitly bind supporting evidence for UPH-02-03:gap."],
      "obligation_id": "UPH-02-03",
      "recommendation_status": "proposed",
      "selected_plan_id": "UPH-02-03:plan"
    },
    {
      "actual_defense_ids": [],
      "gap_state": "gaps",
      "gaps": [
        {"defense_ids": [], "id": "UPH-02-04:gap:member-UPH-02-04:fresh-missing", "kind": "no_defense", "metadata": {}, "next_action": "Implement the member or review the plan. Proposed challenge: Change a bound ground, regenerate disposable state, and require reassessment.", "rationale": "Keep prior assurance current without treating hash drift as failure.", "recommendation_member_ids": ["UPH-02-04:fresh"], "scope": "docs/TRACE_FRESHNESS_BOUNDARY.md", "severity": "unknown", "status": "open", "summary": "Recommended defense member UPH-02-04:fresh has no mapped implementation."},
        {"defense_ids": [], "id": "UPH-02-04:gap:member-UPH-02-04:accept-missing", "kind": "no_defense", "metadata": {}, "next_action": "Implement the member or review the plan. Proposed challenge: Run producers and refresh operations and require binding bytes to stay unchanged.", "rationale": "Keep evidence production separate from human bindings.", "recommendation_member_ids": ["UPH-02-04:accept"], "scope": "docs/TRACE_FRESHNESS_BOUNDARY.md", "severity": "unknown", "status": "open", "summary": "Recommended defense member UPH-02-04:accept has no mapped implementation."}
      ],
      "metadata": {},
      "next_actions": ["Implement the member or review the plan. Proposed challenge: Change a bound ground, regenerate disposable state, and require reassessment.", "Implement the member or review the plan. Proposed challenge: Run producers and refresh operations and require binding bytes to stay unchanged."],
      "obligation_id": "UPH-02-04",
      "recommendation_status": "proposed",
      "selected_plan_id": "UPH-02-04:plan"
    },
    {
      "actual_defense_ids": ["UPH-02-05:d:skill", "UPH-02-05:d:package-tests"],
      "gap_state": "gaps",
      "gaps": [
        {"defense_ids": [], "id": "UPH-02-05:gap:member-UPH-02-05:migrate-missing", "kind": "no_defense", "metadata": {}, "next_action": "Implement the member or review the plan. Proposed challenge: Migrate real 0.1 fixtures and require recommendation status unknown.", "rationale": "Reuse old records without inventing a plan or mapping.", "recommendation_member_ids": ["UPH-02-05:migrate"], "scope": "docs/SCHEMA.md", "severity": "unknown", "status": "open", "summary": "Recommended defense member UPH-02-05:migrate has no mapped implementation."},
        {"defense_ids": [], "id": "UPH-02-05:gap:member-UPH-02-05:import-missing", "kind": "no_defense", "metadata": {}, "next_action": "Implement the member or review the plan. Proposed challenge: Feed reviewed, passing, suspect, and affected states and require no new evidence or binding.", "rationale": "Reuse external identity and change context without importing trust state.", "recommendation_member_ids": ["UPH-02-05:import"], "scope": "docs/SCHEMA.md", "severity": "unknown", "status": "open", "summary": "Recommended defense member UPH-02-05:import has no mapped implementation."},
        {"defense_ids": ["UPH-02-05:d:skill", "UPH-02-05:d:package-tests"], "id": "UPH-02-05:gap:member-UPH-02-05:package-unproven", "kind": "unproven_defense", "metadata": {}, "next_action": "Run a compatible fault challenge and explicitly bind supporting evidence for UPH-02-05:package.", "rationale": "Presence or a passing suite does not establish that the defense detects the stated fault.", "recommendation_member_ids": ["UPH-02-05:package"], "scope": "docs/SCHEMA.md", "severity": "unknown", "status": "open", "summary": "Defense for recommended member UPH-02-05:package exists but has no bound supporting evidence."},
        {"defense_ids": [], "id": "UPH-02-05:gap:member-UPH-02-05:live-missing", "kind": "no_defense", "metadata": {}, "next_action": "Implement the member or review the plan. Proposed challenge: Run held-out client cases and inspect scope, permissions, gaps, and invented evidence.", "rationale": "Show the packaged 0.2 guide follows the full workflow in real clients.", "recommendation_member_ids": ["UPH-02-05:live"], "scope": "docs/SCHEMA.md", "severity": "unknown", "status": "open", "summary": "Recommended defense member UPH-02-05:live has no mapped implementation."}
      ],
      "metadata": {},